{
  "attempted_at": "2026-10-07T07:16:52Z",
  "documents": [
    {
      "bytes": 200695,
      "encoding": "utf-8",
      "media_type": "text/html; charset=UTF-8",
      "present": true,
      "retrieved_at": "2026-10-07T07:14:25Z",
      "role": "catalogue",
      "sha256": "110a5bd859f9c5b74b8caf264705e45b97fc4e2a9e2ba8d2504506b405f4b6a4"
    },
    {
      "bytes": 0,
      "encoding": null,
      "media_type": null,
      "present": false,
      "retrieved_at": null,
      "role": "operation_detail",
      "sha256": null
    },
    {
      "bytes": 0,
      "encoding": null,
      "media_type": null,
      "present": false,
      "retrieved_at": null,
      "role": "reference_guide",
      "sha256": null
    }
  ],
  "evidence_sha256": "f65a895d72fc4d769cfc6b6cc74cf162da013a246e285bcea2f2037d94807418",
  "operation_id": "40b9181a4b8a409ee168299023f4e55fecdedff2b0351f1269f395557f1526ba",
  "reason_code": null,
  "schema_version": "datapan.operation-document-capture-receipt.v2",
  "status": "acquired"
}
