{
  "attempted_at": "2026-10-07T08:50:57Z",
  "documents": [
    {
      "bytes": 207732,
      "encoding": "utf-8",
      "media_type": "text/html; charset=UTF-8",
      "present": true,
      "retrieved_at": "2026-10-07T08:50:07Z",
      "role": "catalogue",
      "sha256": "de326c11ad601d7e81efaa33754ffd971dae6df1ffa733216c921ccdb81ace2b"
    },
    {
      "bytes": 0,
      "encoding": null,
      "media_type": null,
      "present": false,
      "retrieved_at": null,
      "role": "operation_detail",
      "sha256": null
    },
    {
      "bytes": 0,
      "encoding": null,
      "media_type": null,
      "present": false,
      "retrieved_at": null,
      "role": "reference_guide",
      "sha256": null
    }
  ],
  "evidence_sha256": "d09b72e635864527fe94fb6267772e510a04b4dde5f6d9e0f1b167104a4bf83c",
  "operation_id": "0c59120cc0ead58310cd72a894d93240e74964c44d55e26fa5938250d74cdc20",
  "reason_code": null,
  "schema_version": "datapan.operation-document-capture-receipt.v2",
  "status": "acquired"
}
