{
  "attempted_at": "2026-10-07T07:16:50Z",
  "documents": [
    {
      "bytes": 240525,
      "encoding": "utf-8",
      "media_type": "text/html; charset=UTF-8",
      "present": true,
      "retrieved_at": "2026-10-07T07:08:52Z",
      "role": "catalogue",
      "sha256": "56af76decd5f3675566e9b3d2bdbc2b66a6e4089b66bdb8b1136a4b2ecd0fb5a"
    },
    {
      "bytes": 0,
      "encoding": null,
      "media_type": null,
      "present": false,
      "retrieved_at": null,
      "role": "operation_detail",
      "sha256": null
    },
    {
      "bytes": 0,
      "encoding": null,
      "media_type": null,
      "present": false,
      "retrieved_at": null,
      "role": "reference_guide",
      "sha256": null
    }
  ],
  "evidence_sha256": "7d28785a2e7e7417f375fcc530ccda7f67e8c594ca47a2a54b013b3fcab0cfb3",
  "operation_id": "03fcd72448401818e3f66b2d0afbeff7b24b81388fbc4e556dcb6abba5841c5f",
  "reason_code": null,
  "schema_version": "datapan.operation-document-capture-receipt.v2",
  "status": "acquired"
}
