{
  "attempted_at": "2026-10-07T08:50:51Z",
  "documents": [
    {
      "bytes": 223802,
      "encoding": "utf-8",
      "media_type": "text/html; charset=UTF-8",
      "present": true,
      "retrieved_at": "2026-10-07T08:40:35Z",
      "role": "catalogue",
      "sha256": "020df5c477496f28e73129f3f06238a438e35c13f776e5fa8b14c964f2d243f8"
    },
    {
      "bytes": 0,
      "encoding": null,
      "media_type": null,
      "present": false,
      "retrieved_at": null,
      "role": "operation_detail",
      "sha256": null
    },
    {
      "bytes": 0,
      "encoding": null,
      "media_type": null,
      "present": false,
      "retrieved_at": null,
      "role": "reference_guide",
      "sha256": null
    }
  ],
  "evidence_sha256": "703148c8a96f7829d476e8fa06e4bc13ce974713f57a6d4e706a13dbc56593c3",
  "operation_id": "06d4b160d471458005fd26882581ff3fcaa105994dba3cd55a324cf189aa35ac",
  "reason_code": null,
  "schema_version": "datapan.operation-document-capture-receipt.v2",
  "status": "acquired"
}
