{
  "attempted_at": "2026-10-07T08:50:51Z",
  "documents": [
    {
      "bytes": 214435,
      "encoding": "utf-8",
      "media_type": "text/html; charset=UTF-8",
      "present": true,
      "retrieved_at": "2026-10-07T08:40:42Z",
      "role": "catalogue",
      "sha256": "90221b6b17cb64e15839b05effb8b993704903495a38e44ec8d985bb3f6fcea6"
    },
    {
      "bytes": 0,
      "encoding": null,
      "media_type": null,
      "present": false,
      "retrieved_at": null,
      "role": "operation_detail",
      "sha256": null
    },
    {
      "bytes": 0,
      "encoding": null,
      "media_type": null,
      "present": false,
      "retrieved_at": null,
      "role": "reference_guide",
      "sha256": null
    }
  ],
  "evidence_sha256": "2aaa842111fcf161966a1c376f9aae0e8975bf54a4147177ba6277a17765edc9",
  "operation_id": "06eef4801680542881a6fa8ae512dbed09529ff7e1939469ebe307bbef00ca0e",
  "reason_code": null,
  "schema_version": "datapan.operation-document-capture-receipt.v2",
  "status": "acquired"
}
