{
  "attempted_at": "2026-10-07T08:50:54Z",
  "documents": [
    {
      "bytes": 239736,
      "encoding": "utf-8",
      "media_type": "text/html; charset=UTF-8",
      "present": true,
      "retrieved_at": "2026-10-07T08:44:43Z",
      "role": "catalogue",
      "sha256": "58cb7c2e393d4ab7309faa97875fd2e85888cb5313bb93ec514786adad322f31"
    },
    {
      "bytes": 0,
      "encoding": null,
      "media_type": null,
      "present": false,
      "retrieved_at": null,
      "role": "operation_detail",
      "sha256": null
    },
    {
      "bytes": 0,
      "encoding": null,
      "media_type": null,
      "present": false,
      "retrieved_at": null,
      "role": "reference_guide",
      "sha256": null
    }
  ],
  "evidence_sha256": "cf58d9260b327001f1cda0949f049a0e614bb4a803905568ce716befd0e48b77",
  "operation_id": "0a1b7d8b0203443e745255ba86ca03515a02485a2951d70f06922f6bd965b53f",
  "reason_code": null,
  "schema_version": "datapan.operation-document-capture-receipt.v2",
  "status": "acquired"
}
