{
  "attempted_at": "2026-10-07T08:50:54Z",
  "documents": [
    {
      "bytes": 201169,
      "encoding": "utf-8",
      "media_type": "text/html; charset=UTF-8",
      "present": true,
      "retrieved_at": "2026-10-07T08:44:23Z",
      "role": "catalogue",
      "sha256": "2879ad88f3e170275b75c94638f55d2b6ee463435d883de1a609b7bcb3232d95"
    },
    {
      "bytes": 0,
      "encoding": null,
      "media_type": null,
      "present": false,
      "retrieved_at": null,
      "role": "operation_detail",
      "sha256": null
    },
    {
      "bytes": 0,
      "encoding": null,
      "media_type": null,
      "present": false,
      "retrieved_at": null,
      "role": "reference_guide",
      "sha256": null
    }
  ],
  "evidence_sha256": "3fda6b759cea1c2c3e795d24dbe537600f5943c346ce3d15a15f5995e724c75a",
  "operation_id": "09c014798559932e0544b3bc06a6e1b47b75db31d58b511892e985a4a8626223",
  "reason_code": null,
  "schema_version": "datapan.operation-document-capture-receipt.v2",
  "status": "acquired"
}
