{
  "attempted_at": "2026-10-07T08:50:56Z",
  "documents": [
    {
      "bytes": 199747,
      "encoding": "utf-8",
      "media_type": "text/html; charset=UTF-8",
      "present": true,
      "retrieved_at": "2026-10-07T08:48:08Z",
      "role": "catalogue",
      "sha256": "54985ef1dc98339a9ffe2d3d25d999c2045159350007b8f22d64073b53f0ccd4"
    },
    {
      "bytes": 0,
      "encoding": null,
      "media_type": null,
      "present": false,
      "retrieved_at": null,
      "role": "operation_detail",
      "sha256": null
    },
    {
      "bytes": 0,
      "encoding": null,
      "media_type": null,
      "present": false,
      "retrieved_at": null,
      "role": "reference_guide",
      "sha256": null
    }
  ],
  "evidence_sha256": "cf708c168747a8a347de2e20bc45ab394cacc1619216cf0f8c09a541679bc430",
  "operation_id": "0b410b20ee4cfe2781a09b513748bbc95b96c27a73621888706dd5fd4f512757",
  "reason_code": null,
  "schema_version": "datapan.operation-document-capture-receipt.v2",
  "status": "acquired"
}
